{"$schema":"https://json-schema.org/draft/2020-12/schema","type":"object","required":["schema_version","generated_at","weights","summary_stats","results"],"properties":{"schema_version":{"const":"1.0"},"generated_at":{"type":"string"},"weights":{"type":"object","required":["alpha","beta","gamma","delta"]},"summary_stats":{"type":"object"},"results":{"type":"array","items":{"type":"object","required":["app_id","app_name","drift_sequence","cumulative_pdi"],"properties":{"app_id":{"type":"string"},"drift_sequence":{"type":"array","items":{"type":"object","required":["from_version","to_version","components","pdi"]}}}}}}}
